Title,URL,Content
Introduction to Machine Learning,https://sebastianraschka.com/blog/2021/ml-course.html,
Introduction to Machine Learning,https://www.coursera.org/learn/machine-learning-introduction-for-everyone,Machine Learning Introduction for Everyone | Coursera
Introduction to Machine Learning,https://www.analyticsvidhya.com/blog/2021/02/introduction-to-machine-learning-for-absolute-beginners/,"Introduction to Machine Learning for Absolute Beginners - Analytics Vidhya Explore Discover Blogs Unpacking the latest trends in AI - A knowledge capsule Leadership Podcasts Know the perspective of top leaders Expert Sessions Go deep with industry leaders in live, interactive sessions Comprehensive Guides Master complex topics with comprehensive, step-by-step resources Learn Free Courses Kickstart your AI journey with our comprehensive courses Certified AI & ML BlackBelt Plus Program Master AI like a pro with our mentor-driven program Learning Paths Expert-curated paths for every goal Gen AI Pinnacle Program Learn cutting-edge skills for your AI career Engage Thriving Community Share knowledge, spark ideas, and build connections Exciting Events Dive into the hottest trends and network with industry leaders Challenging Hackathons Test your skills, unleash your creativity, and win big DataHack Summit 2024 India's Most Futuristic GenAI Conference Contribute Become a Wordsmith Share your voice, and win big in blogathons Become a Mentor Craft careers by sharing your knowledge Become a Speaker Inspire minds, share your expertise Become an Instructor Shape next-gen innovators through our programs Corporate Our Offerings Build a data-powered and data-driven workforce Trainings Bridge your team's data skills with targeted training Analytics maturity Unleash the power of analytics for smarter outcomes Data Culture Break down barriers and democratize data access and usage Login Switch Mode Logout d : h : m : s Home Beginner"
Introduction to Machine Learning,https://www.blog.trainindata.com/machine-learning-for-beginners/,
Introduction to Machine Learning,https://www.evidentlyai.com/blog/best-machine-learning-blogs,50 best machine learning blogs from engineering teams
Supervised Learning: Regression,https://medium.com/the-quant-journey/supervised-machine-learning-regression-and-classification-decision-trees-2a8544b15a7b,"Supervised Machine Learning: Regression and Classification  Decision Trees | by Andrea Chello | The Quant Journey | MediumOpen in appSign upSign inWriteSign upSign inMember-only storySupervised Machine Learning: Regression and Classification  Decision TreesAndrea ChelloFollowPublished inThe Quant Journey10 min readOct 8, 2021--ShareIntroductionThis is a comprehensive guide to regression and classification tasks for Decision Trees, known as CARTs (Classification and Regression Trees).Supervised learning refers to machine learning that is based on a training set of labeled examples. A supervised learning model trains on a dataset----FollowWritten by Andrea Chello496 FollowersEditor for The Quant JourneyQuant | Full-Stack Blockchain DeveloperFollowHelpStatusAboutCareersPressBlogPrivacyTermsText to speechTeams"
Supervised Learning: Regression,https://www.coursera.org/learn/supervised-machine-learning-regression,Supervised Machine Learning: Regression | Coursera
Supervised Learning: Regression,https://medium.com/codex/your-guide-to-supervised-machine-learning-regression-d6b822563e44,"Your guide to Supervised Machine Learning  Regression | by Harshit Yadav | CodeX | MediumOpen in appSign upSign inWriteSign upSign inYour guide to Supervised Machine Learning  RegressionHarshit YadavFollowPublished inCodeX12 min readJan 21, 2022--ListenShareLearning and developing an intuition for the working of RegressionPhoto by Liam Charmer on UnsplashNote: Four pillars of Machine Learning #2  Linear algebra and calculus is the previous blog in the Complete Machine Learning and Deep Learning for Beginners series. It is recommended to have the prior knowledge discussed in the last of blogs.The little Code and data used in this Blog can be found here, Do not worry if you do not know how to code or do not understand the code in this blog. This blog is not a coding tutorial. This blogs purpose is to explain the concepts, you can ignore the code as this tutorial is not coding dependent, but if someone wants to dig deep, they can go through it.For those unfamiliar with code or Libraries used, a blog will be released as a part of this series which will introduce you to coding and libraries used.Blogs Outline:IntroductionSupervised Machine Learning2.1 Introduction to Regression2.2 Introduction to Classification2.3 Continuous and Discrete Data3. Regression3.1 Dependent and Independent Variables3.2 Types of Regressions3.3 Simple Linear Regression3.4 Multiple Linear Regression1. IntroductionWe have already discussed supervised and unsupervised machine learning earlier in this series. In this blog, we will learn more about Regression in Supervised Machine Learning and how it works. You will need a bit of Mathematics, nothing too high; just a basic knowledge of Linear Algebra will be helpful.2. Supervised Machine LearningAs discussed earlier in one of our previous blogs (Getting Familiar to The World of Machine Learning), when we train our model based on some labelled dataset, it falls under Supervised Machine Learning. Now, this type of Machine Learning is"
Supervised Learning: Regression,https://medium.com/analytics-vidhya/supervised-machine-learning-linear-regression-b6baa9a66cd9,"Supervised Machine learning  Linear Regression | by Divyashree E | Analytics Vidhya | MediumOpen in appSign upSign inWriteSign upSign inSupervised Machine learning  Linear RegressionDivyashree EFollowPublished inAnalytics Vidhya6 min readDec 30, 2019--ListenShareIn Supervised Machine Learning, the models are trained by providing data that is tagged with a correct label. There are several algorithms under supervised machine learning and one of them is Linear Regression.In this post, you will come across a brief note on the introduction for linear regression, types of linear regression, assumptions of linear regression, how linear regression works, methods for estimating the coefficient and the intercept and implementing the model in python.Introduction to linear regressionIn machine learning under the category of supervised machine learning, linear regression is one of the simplest parametric methods that you can apply to a dataset to model the relationship between the dependent variable (or response variable) and one or more independent variables(or explanatory variables).In linear regression, the values of the dependent variable are continuous in nature. The linear regression is used for forecasting, time-series data, identifying the cause and effect relationship and many more.Types of Linear RegressionSimple Linear Regression: If there is only one independent variable then it is Simple Linear Regression.Multiple Linear Regression: If there are two or more independent variables then it is called Multiple Linear Regression.Assumptions of Linear RegressionLinearity: There must be a linear relationship between the independent variable and the dependent variable.Homoscedasticity or homogeneity: The residuals(or error terms) must possess a constant variance, regardless of the independent variable.Lack of multicollinearity: There must be no correlation between the independent variables.Independent of residuals(or error): The residuals must be independent of each"
Supervised Learning: Regression,https://www.kdnuggets.com/handson-with-supervised-learning-linear-regression,"Hands-On with Supervised Learning: Linear Regression - KDnuggets Blog Top Posts About Topics AI Career Advice Computer Vision Data Engineering Data Science Language Models Machine Learning MLOps NLP Programming Python SQL Datasets Events Resources Cheat Sheets Recommendations Tech Briefs Join Newsletter Hands-On with Supervised Learning: Linear Regression If you're looking for a hands-on experience with a detailed yet beginner-friendly tutorial on implementing Linear Regression using Scikit-learn, you're in for an engaging journey. By Kanwal Mehreen, KDnuggets Technical Editor & Content Specialist on September 18, 2023 in Machine Learning Image by Author Basic Overview Linear regression is the fundamental supervised machine learning algorithm for predicting the continuous target variables based on the input features. As the name suggests it assumes that the relationship between the dependant and independent variable is linear. So if we try to plot the dependent variable Y against the independent variable X, we will obtain a straight line. The equation of this line can be represented by: Where, Y Predicted output. X = Input feature or feature matrix in multiple linear regression b0 = Intercept (where the line crosses the Y-axis). b1 = Slope or coefficient that determines the line's steepness."
Supervised Learning: Classification,https://blog.dennisokeeffe.com/blog/2021-08-14-first-look-at-supervised-learning-with-classification,"First Look At Supervised Learning With ClassificationBack to homeFirst Look At Supervised Learning With Classificationpython100daysofpythonmachine learningThis is Day 27 of the #100DaysOfPython challenge.This post will look at setting up our template repository for scikit-learn with Miniconda (a minimal installer for conda).We will do this by using the scikit-learn package to create a GitHub template repository for our Machine Learning projects.The final code can be found at okeeffed/supervised-learning-with-scikit-learn-template.PrerequisitesFamiliarity Conda package, dependency and virtual environment manager. A handy additional reference for Conda is the blog post ""The Definitive Guide to Conda Environments"" on ""Towards Data Science"".Familiarity with JupyterLab. See here for my post on JupyterLab.These projects will also run Python notebooks on VSCode with the Jupyter Notebooks extension. If you do not use VSCode, it is expected that you know how to run notebooks (or alter the method for what works best for you).Getting startedLet's create the supervised-learning-with-scikit-learn-template directory and install the required packages.# Make the `supervised-learning-with-scikit-learn-template` directory $ mkdir supervised-learning-with-scikit-learn-template $ cd supervised-learning-with-scikit-learn-template # Create a docs folder to place our notebook $ mkdir docs $ touch docs/supervised-learning-with-scikit-learn-template.ipynb"
Supervised Learning: Classification,https://medium.com/codex/your-guide-to-supervised-learning-classification-6f0eeb8b7049,"Your guide to Supervised Learning  Classification | by Sarthak Malik | CodeX | MediumOpen in appSign upSign inWriteSign upSign inYour guide to Supervised Learning  ClassificationSarthak MalikFollowPublished inCodeX12 min readFeb 3, 2022--ListenShareOne-stop for Logistic regression and decision treePhoto by Caleb Jones on UnsplashThe following blog is the fifth blog in the ""Complete Machine Learning and Deep Learning for Beginners"" series. In the earlier blog, Your guide to Supervised Machine Learning  Regression, we got an insight into what regression is and how we can make models required in regression; we learned about simple linear regression, multiple linear regression, and logistic regression. Today we will be going through classification and different basic models used for classification. We will get a theoretical view of how these models work and then dive into the mathematics behind these algorithms. Don't worry; we will be keeping this as simple and easy as possible. So let us begin !!!ClassificationMost of the tasks in our daily life may be choosing whether to go out or not, whether we will be able to do something or not, what color an object is, and even what the thing is; these are all classifications. As a human, it is necessary to classify objects correctly.Furthermore, if we are speaking of making a program similar to humans, it must be essential to classify things. Now, if we go into mathematical terms as discussed in the previous blog, ""classification means to predict discrete variables or to tell the category of objects."" Broadly classification can be divided into Binary classification and multi-class classification.Binary classification: As the name suggests, it means to classify in two classes or categories ( Remember, it is a convention to use classes for discrete categories in machine learning ). It is like We ask our program to answer ""YES"" or ""NO.""Multi-class classification: Multi-class classification is when we have to predict more"
Supervised Learning: Classification,https://www.datacamp.com/blog/classification-machine-learning,
Supervised Learning: Classification,https://blog.quantinsti.com/machine-learning-classification/,"Machine Learning Classification: Concepts, Models, Algorithms and more x Home Courses Self-Paced Courses Quantra Browse All Courses Algo Trading Specialisation Looking for live online classesand career support? Executive Program in Algorithmic Trading Explore EPAT Courses Quant Jobs Blogs Login Career Growth Industry Jobs & Skills Trading Desk Setup Success Stories EPAT Trading Projects Tutorials Automated Trading Forex & Crypto Trading Machine Learning Maths and Econometrics Mean Reversion & Statistical Arbitrage Momentum Trading More Trading Strategies Options Trading Portfolio & Risk Management Python For Trading Sentiment Trading Technical Analysis Machine Learning This Blog Machine Learning Classification: Concepts, Models, Algorithms and more Machine Learning Nov 30, 2023 24 min read"
Supervised Learning: Classification,https://builtin.com/data-science/supervised-machine-learning-classification,5 Classification Algorithms for Machine Learning | Built In View All Jobs For Employers Post Job Join Log In JobsMost Popular Jobs All Tech JobsRemote Tech JobsData + AnalyticsDesign + UXDeveloper + Engineer FinanceHR + RecruitingLegalMarketingOperations ProductProject Mgmt.Sales See All Jobs CompaniesMost Popular Searches All CompaniesA.I. Companies Best Places to WorkFintech Companies Fully Remote Companies See All Companies ArticlesMost Popular Tech Topics Artificial IntelligenceBlockchainCloud ComputingCyber SecurityData Science EdtechExpert ContributorsFintechHardwareHealthcare Technology IoT: The Internet of ThingsRemote WorkRoboticsTransportation TechSoftware Engineering See All Articles SalariesMost Popular Salaries Account ExecutiveAccount ManagerData ScientistFront End Developer HR ManagerMarketing ManagerOperations ManagerProduct Designer Product ManagerProject ManagerSoftware EngineerUX Designer See All Salaries Courses My items Expert Contributors Machine Learning Algorithms Data Science +2 +4 5 Classification Algorithms for Machine Learning An exhaustive understanding of classification algorithms in machine learning.
Unsupervised Learning: Clustering,https://towardsdatascience.com/unsupervised-learning-and-data-clustering-eeecb78b422a,"Unsupervised Learning and Data Clustering | by Sanatan Mishra | Towards Data ScienceOpen in appSign upSign inWriteSign upSign inUnsupervised Learning and Data ClusteringSanatan MishraFollowPublished inTowards Data Science15 min readMay 19, 2017--1ListenShareA task involving machine learning may not be linear, but it has a number of well known steps:Problem definition.Preparation of Data.Learn an underlying model.Improve the underlying model by quantitative and qualitative evaluations.Present the model.One good way to come to terms with a new problem is to work through identifying and defining the problem in the best possible way and learn a model that captures meaningful information from the data. While problems in Pattern Recognition and Machine Learning can be of various types, they can be broadly classified into three categories:Supervised Learning:The system is presented with example inputs and their desired outputs, given by a teacher, and the goal is to learn a general rule that maps inputs to outputs.Unsupervised Learning:No labels are given to the learning algorithm, leaving it on its own to find structure in its input. Unsupervised learning can be a goal in itself (discovering hidden patterns in data) or a means towards an end (feature learning).Reinforcement Learning:A system interacts with a dynamic environment in which it must perform a certain goal (such as driving a vehicle or playing a game against an opponent). The system is provided feedback in terms of rewards and punishments as it navigates its problem space.Between supervised and unsupervised learning is semi-supervised learning, where the teacher gives an incomplete training signal: a training set with some (often many) of the target outputs missing. We will focus on unsupervised learning and data clustering in this blog post.Unsupervised LearningIn some pattern recognition problems, the training data consists of a set of input vectors x without any corresponding target values. The goal in"
Unsupervised Learning: Clustering,https://towardsdatascience.com/unsupervised-learning-k-means-clustering-27416b95af27,"Unsupervised Learning: K-Means Clustering | by Brendan Artley | Towards Data ScienceOpen in appSign upSign inWriteSign upSign inUnsupervised Learning: K-Means ClusteringThe fastest and most intuitive unsupervised clustering algorithm.Brendan ArtleyFollowPublished inTowards Data Science6 min readJun 27, 2022--1ListenShareClusters Image  By AuthorIn this article, we will go through the k-means clustering algorithm. We will first start looking at how the algorithm works, then we will implement it using NumPy, and finally, we will look at implementing it using Scikit-learn.IntroductionK-means clustering is an unsupervised algorithm that groups unlabelled data into different clusters. The K in its title represents the number of clusters that will be created. This is something that should be known prior to the model training. For example, if K=4 then 4 clusters would be created, and if K=7 then 7 clusters would be created. The k-means algorithm is used in fraud detection, error detection, and confirming existing clusters in the real world.The algorithm is centroid-based, meaning that each data point is assigned to the cluster with the closest centroid. This algorithm can be used for any number of dimensions as we calculate the distance to centroids using the euclidian distance. More on this in the next section.The benefits of the k-means algorithm are that it is easy to implement, it scales to large datasets, it will always converge, and it fits clusters with varying shapes and sizes. Some disadvantages of the model are that the number of clusters is chosen manually, the clusters are dependent on initial values, and that it is sensitive to outliers.K-means StepsThe steps of training a K-means model can be broken down into 6 steps.Step 1: Determine the number of clusters (K=?)It is best if K is known before model training, but if not, there are strategies to find K. The most common is the elbow method, which plots the sum of the squared distances as K increases. By"
Unsupervised Learning: Clustering,https://medium.com/codex/your-guide-to-unsupervised-machine-learning-clustering-10ea9cd26412,"Your Guide to Unsupervised Machine Learning  Clustering | by Harshit Yadav | CodeX | MediumOpen in appSign upSign inWriteSign upSign inYour Guide to Unsupervised Machine Learning  ClusteringHarshit YadavFollowPublished inCodeX10 min readFeb 16, 2022--ListenShareBuilding Intuition and Logic for Clustering along with Visualisation of K-Means algorithm on a datasetSource  LinkIntroductionIn previous blogs (Getting Familiar to the World of Machine Learning), we learned about Unsupervised Machine Learning. Unlike Supervised Machine Learning in this, we identify the data points in relation to other data points because this type of Machine Learning Algorithm does not make use of Labelled Data as it does in Supervised Machine Learning. If you need more clarification on the topic, try reading the Unsupervised Machine learning section of (Getting Familiar to the World of Machine Learning).Unsupervised Machine LearningUnsupervised Machine Learning is used when we need to find out underlying hidden patterns in an Unlabelled Dataset, Unsupervised Machine Learning is further classified into two sections:Clustering  Grouping of similar data points to form different cultures.Association  Finding important relations between data points.In this blog, we will be learning how clustering works and what methodologies can we use to perform clustering over Unlabelled Data.ClusteringSuppose you are presented with a basket full of flowers, and the basket can contain any number of different categories of flowers. For example, the basket may contain 5 flowers of type-1, 3 flowers of type-2 etc. The catch here is that you have Blindfolds on, and you can not see and distinguish between categories of flowers. Now how would you differentiate one type of flower from others?Since you can not take the blindfold off, one way to distinguish between different types of flowers is to pick one flower and place it out of the basket, pick another flower and try to feel if it is similar to the"
Unsupervised Learning: Clustering,https://medium.com/@mlpick/a-beginners-guide-to-unsupervised-learning-clustering-models-30a9639889fc,"A Beginners Guide to Unsupervised Learning Clustering Models | by Meghan Pick | MediumOpen in appSign upSign inWriteSign upSign inA Beginners Guide to Unsupervised Learning Clustering ModelsMeghan PickFollow8 min readJul 30, 2021--1ListenShareWith An Allegory Using the Movie Mean GirlsWhen you are just starting on your data science journey, approaching unsupervised learning can feel like a approaching a mountain that you are expected to climb. The intention of this blog post is to act as a paved road to the mountain base camp  that is, help you get a look at the whole mountain before you go for metaphorical hike. There are a lot of blogs about individual unsupervised learning techniques but something I wished I had when I started learning about unsupervised learning was a high level comparison of the main unsupervised learning clustering methods.The goal of clustering is to segment the population into smaller, differentiable segments. I have seen clustering analysis being described as not having a specific goal in mind, but that undersells both the algorithms and the data scientist executing them. The goal  or purpose of executing the algorithm is set by the data scientist writing and executing the code. So as a heads up  unsupervised learning does require a lot of interpretation on the part of the data scientist.In this article I wont be using numbers or code. Instead, I will compare the three main approaches to clustering (hierarchal, centroid, or density based) using a symbolic example with the characters from the 2004 film Mean Girls. If youre not familiar with the movie, I recommend a quick read of the review. But really, all you need to know is that in the movie, Cady is a new girl trying to fit into an existing High school social organizationThe Set UpImagine you are the principal at a highschool. Over the summer you remodeled the schools cafeteria and now you need to buy new tables and chairs. You have two questions:(a) how many tables do I"
Unsupervised Learning: Clustering,https://towardsdatascience.com/unsupervised-learning-method-series-exploring-k-means-clustering-d129fff3ab6a,"Unsupervised Learning Method Series  Exploring K-Means Clustering | by Ivo Bernardo | Towards Data ScienceOpen in appSign upSign inWriteSign upSign inMember-only storyUnsupervised Learning Method Series  Exploring K-Means ClusteringLets explore one of the most famous unsupervised learning methods and how it uses distances to map similar instances togetherIvo BernardoFollowPublished inTowards Data Science13 min readApr 5, 2023--4SharePhoto by alexlanting @Unsplash.comUnsupervised learning is a misterious, yet fun, art. While there is no ground truth label to predict and it may be harder to evaluate the----4FollowWritten by Ivo Bernardo1.1K FollowersWriter for Towards Data ScienceI write about data science and analytics | Partner @ DareData | Instructor @ Udemy | also on thedatajourney.substack.com/ and youtube.com/@TheDataJourney42FollowHelpStatusAboutCareersPressBlogPrivacyTermsText to speechTeams"
Unsupervised Learning: Dimensionality Reduction,https://towardsdatascience.com/unsupervised-learning-dimensionality-reduction-ddb4d55e0757,"Unsupervised Learning: Dimensionality Reduction | by Victor Roman | Towards Data ScienceOpen in appSign upSign inWriteSign upSign inMember-only storyUnsupervised Learning: Dimensionality ReductionCompress features, reduce overfitting and noise and increase eficciency and performanceVictor RomanFollowPublished inTowards Data Science9 min readApr 17, 2019--6SharePicture from UnsplashIntroductionAs stated in previous articles, unsupervised learning refers to a kind of machine learning algorithms and techniques that are trained and fed with unlabeled data. In other words, we do not----6FollowWritten by Victor Roman2.4K FollowersWriter for Towards Data ScienceIndustrial Engineer and passionate about 4.0 Industry. My goal is to encourage people to learn and explore its technologies and their infinite posibilites.FollowHelpStatusAboutCareersPressBlogPrivacyTermsText to speechTeams"
